{
    "schema_version": 1,
    "module": {
        "module_public_key": "test.showcase.responses",
        "name": "Tipos de resposta",
        "call_name": "respostas",
        "icon": "data_object",
        "parent_public_key": "test.showcase",
        "description": "Demonstra todas as formas de resultado reconhecidas pelo fluxo atual.",
        "readme": "README.md",
        "is_executable": true
    },
    "runtime": {
        "type": "python",
        "entrypoint": "main.py",
        "supports_auto_start": false
    },
    "variables": []
}
