{
    "schema_version": 1,
    "module": {
        "module_public_key": "test.showcase.contracts.main",
        "name": "Função main",
        "call_name": "main",
        "icon": "terminal",
        "parent_public_key": "test.showcase.contracts",
        "description": "Demonstra o fallback final para a função main.",
        "readme": "README.md",
        "is_executable": true
    },
    "runtime": {
        "type": "python",
        "entrypoint": "main.py",
        "supports_auto_start": false
    },
    "variables": []
}
