{
    "schema_version": 1,
    "module": {
        "module_public_key": "test.showcase.contracts.run",
        "name": "Função run",
        "call_name": "run",
        "icon": "directions_run",
        "parent_public_key": "test.showcase.contracts",
        "description": "Demonstra o fallback para a função run.",
        "readme": "README.md",
        "is_executable": true
    },
    "runtime": {
        "type": "python",
        "entrypoint": "main.py",
        "supports_auto_start": false
    },
    "variables": []
}
