{
    "schema_version": 1,
    "module": {
        "module_public_key": "example.echo",
        "name": "Exemplo mínimo",
        "call_name": "exemplo",
        "icon": "extension",
        "parent_public_key": null,
        "description": "Demonstra o contrato mínimo de um módulo executável.",
        "readme": "README.md",
        "is_executable": true
    },
    "runtime": {
        "type": "python",
        "entrypoint": "main.py",
        "supports_auto_start": false
    },
    "variables": [
        {
            "key": "prefix",
            "label": "Prefixo",
            "description": "Texto não sensível exibido antes do argumento.",
            "type": "text",
            "required": false,
            "user_editable": true,
            "default_value": "IRIS"
        }
    ],
    "vault_keys": []
}
